### ISSUE TITLE
安装完成后ipv4 tcp端口没有监听，客户端无法连接

### ISSUE THREAD

**Issue by q14859** [233boy/v2ray#1199]
### **相关信息如下：**
[root@instance-20230807-2056 ~]# netstat -anp |grep ':54063'
tcp6       0      0 :::54063                :::*                    LISTEN      221347/v2ray

[root@instance-20230807-2056 ~]# v2ray status

V2Ray 5.7.0: running

[root@instance-20230807-2056 ~]# v2ray info
-------------- VMess-TCP-54063.json -------------
协议 (protocol)         = vmess
地址 (address)          = ***
端口 (port)             = 54063
用户ID (id)             = ***
传输协议 (network)      = tcp
伪装类型 (type)         = none
------------- 链接 (URL) -------------
vmess://****=
------------- END -------------
关注(tg): https://t.me/tg2333
文档(doc): https://233boy.com/v2ray/v2ray-script/
推广(ads): 机场推荐(V2Ray services): https://getjms.com/

[root@instance-20230807-2056 ~]# systemctl status firewalld
● firewalld.service
   Loaded: masked (Reason: Unit firewalld.service is masked.)
   Active: inactive (dead)
[root@instance-20230807-2056 ~]# service iptables status
Redirecting to /bin/systemctl status iptables.service
Unit iptables.service could not be found.
[root@instance-20230807-2056 ~]# cat /etc/redhat-release
Red Hat Enterprise Linux release 8.8 (Ootpa)

### **tcpdump能够看到包进来，但v2ray不回应：**
[root@instance-20230807-2056 ~]# tcpdump -nnnnne |grep 54063
dropped privs to tcpdump
tcpdump: verbose output suppressed, use -v or -vv for full protocol decode
listening on ens3, link-type EN10MB (Ethernet), capture size 262144 bytes
09:43:20.434701 00:00:17:f3:71:f7 > 02:00:17:01:9b:80, ethertype IPv4 (0x0800), length 66: 158.180.72.59.4256 > 10.0.0.66.54063: Flags [S], seq 3159213795, win 64240, options [mss 1361,nop,wscale 8,nop,nop,sackOK], length 0
09:43:21.449373 00:00:17:f3:71:f7 > 02:00:17:01:9b:80, ethertype IPv4 (0x0800), length 66: 158.180.72.59.4256 > 10.0.0.66.54063: Flags [S], seq 3159213795, win 64240, options [mss 1361,nop,wscale 8,nop,nop,sackOK], length 0
09:43:23.464112 00:00:17:f3:71:f7 > 02:00:17:01:9b:80, ethertype IPv4 (0x0800), length 66: 158.180.72.59.4256 > 10.0.0.66.54063: Flags [S], seq 3159213795, win 64240, options [mss 1361,nop,wscale 8,nop,nop,sackOK], length 0
09:43:27.464828 00:00:17:f3:71:f7 > 02:00:17:01:9b:80, ethertype IPv4 (0x0800), length 66: 158.180.72.59.4256 > 10.0.0.66.54063: Flags [S], seq 3159213795, win 64240, options [mss 1361,nop,wscale 8,nop,nop,sackOK], length 0
09:43:35.474394 00:00:17:f3:71:f7 > 02:00:17:01:9b:80, ethertype IPv4 (0x0800), length 66: 158.180.72.59.4256 > 10.0.0.66.54063: Flags [S], seq 3159213795, win 64240, options [mss 1361,nop,wscale 8,nop,nop,sackOK], length 0

^C138 packets captured
139 packets received by filter
0 packets dropped by kernel

**Comment by 233boy** [comment]
配置默认是监听 0.0.0.0 的，不太清楚你这个怎么回事 @q14859

**Comment by vanehu** [comment]
> 配置默认是监听 0.0.0.0 的，不太清楚你这个怎么回事 @q14859

请问一下 亚马逊云 0.0.0,0监听只有ipv6没ipv4这个好奇怪知道啥原因么

**Comment by q14859** [comment]
> > 配置默认是监听 0.0.0.0 的，不太清楚你这个怎么回事 @q14859
> 
> 请问一下 亚马逊云 0.0.0,0监听只有ipv6没ipv4这个好奇怪知道啥原因么

看来跟我问题类似。我是oracle云

**Comment by JoeCao** [comment]
我也是这个现象，我是oracle云。 我自己用python写了一个ipv4的服务端口监听是没问题的，但是脚本启动的，只是ipv6有监听

**Comment by LijiaHou** [comment]
老铁解决了嘛，我也遇到类似问题，能收到包，但是客户端v2ray连接不上，客户端控制台一直在各种乱ping

**Comment by BaldStrong** [comment]
试下把caddy的配置精简一下，比如注释掉这两行port
![image](https://github.com/user-attachments/assets/f57beb27-653f-48a9-8f22-3393d6dc1f29)

**Comment by q14859** [comment]
@BaldStrong 改了也不行。ubuntu 22.04 24.04, Oracle Linux 8都是一样的情况。阿里云ubuntu 22.04也一样

**Comment by q14859** [comment]
问题找到了，netstat命令输出是错的，晕死。用ss命令显示正常：
**netstat -an |grep 32773**
**tcp6**       0      0 :::32773                :::*                    LISTEN  

**ss -l |grep 32773**
**tcp**   LISTEN 0      4096                                                  *:32773                          *:*          

本机端口测试也是通的：
**ssh -v -p 32773 localhost**
OpenSSH_9.6p1 Ubuntu-3ubuntu13.5, OpenSSL 3.0.13 30 Jan 2024
debug1: Reading configuration data /etc/ssh/ssh_config
debug1: /etc/ssh/ssh_config line 19: include /etc/ssh/ssh_config.d/*.conf matched no files
debug1: /etc/ssh/ssh_config line 21: Applying options for *
debug1: Connecting to localhost [127.0.0.1] port 32773.
debug1: Connection established.

Oracle security list放通后，远端也通了。
